{
  "schema": "ULISDOQ_DOCUMENTARY_INSTRUCTION_V1",
  "request_id": "ULISDOQ-REQ-GEDREAL-20261024T213000Z-001",
  "request_version": 1,
  "correlation_id": "GED04-DOCUMENTARY-CAPABILITY-20261024-001",
  "request_commit": "3bac3126e552fb6227e0ac041b2c636e884423c2",
  "result_status": "NEEDS_MORE_EVIDENCE",
  "capability_decision": "SOURCE_EVIDENCE_REQUIRED",
  "documentary_classification": {
    "issuer_or_source_category": {
      "value": "INSURANCE_PROVIDER_OR_INTERMEDIARY",
      "status": "INFERRED"
    },
    "business_domain": {
      "value": "INSURANCE",
      "status": "INFERRED"
    },
    "presumed_document_family": {
      "value": "INSURANCE_CONTRACTUAL_DOCUMENT_OR_AMENDMENT",
      "status": "HYPOTHESIS"
    },
    "document_role": {
      "value": "CONTRACTUAL_TERMS_AND_PARTICULARS",
      "status": "HYPOTHESIS"
    }
  },
  "verification": {
    "current_evidence_sufficient_for_profile_reuse_claim": false,
    "current_evidence_sufficient_for_field_semantic_model": false,
    "independent_same_family_specimen_available": false,
    "circular_self_match_forbidden": true,
    "required_next_evidence": [
      "Restricted local examination of the existing source, or a structure-preserving controlled representation, sufficient to define field semantics and extraction grammar.",
      "At least one independent same-family specimen before claiming reusable family recognition or reusable profile robustness."
    ]
  },
  "reuse_boundary": {
    "current_claim": "DOCUMENTARY_CLASSIFICATION_HYPOTHESIS_ONLY",
    "may_generalize_profile": false,
    "may_claim_family_recognition": false,
    "may_publish_private_source": false
  },
  "produced_refs": {
    "profile_id": null,
    "capability_id": null,
    "profile_builder_version": "0.1.1-candidate",
    "instruction_contract": "ULISDOQ_DOCUMENTARY_INSTRUCTION_V1"
  },
  "limits": [
    "No private source document was processed through this Git exchange.",
    "No field grammar can be qualified from the minimized package alone.",
    "One specimen is insufficient to demonstrate reusable family recognition.",
    "This result is an instruction decision, not a profile candidate."
  ],
  "next_action": {
    "action": "PROVIDE_ADDITIONAL_EVIDENCE",
    "target_ref": null,
    "requirement": "Provide a restricted local review path or a controlled structure-preserving representation for semantic field and extraction-grammar instruction; keep the private source outside public Git. Obtain an independent same-family specimen before any reusable recognition claim."
  },
  "result_version": 1,
  "created_at": "2026-10-24T21:40:00Z"
}
